{
  "$id": "urn:ratatoskr:contracts:backup:v1:DesiredBackupPolicy",
  "$schema": "https://json-schema.org/draft/2020-12/schema",
  "title": "DesiredBackupPolicy",
  "description": "The versioned policy document GitHub publishes: which repositories must be preserved and at\nwhat depth.\n\nNamed `DesiredBackupPolicy`, not `BackupPolicy`, because it states intent, not achieved\nstate: Vault answers each version through [`PolicyAcknowledged`]\n(`crate::PolicyAcknowledged`). Successive documents for the same estate carry strictly\nincreasing `policy_version` values; succession itself is checked by\n[`validate_policy_succession`], because one document cannot know its predecessor.\n\n`Deserialize` is hand-written because two invariants are cross-field: the version floor and\nper-document uniqueness of repository references. It parses a private mirror struct and then\nchecks. A field added to the public struct and not to the mirror would be silently dropped;\nthe committed full-policy fixture round-trips through `cargo contracts check`, which fails\nthe moment that happens.",
  "type": "object",
  "properties": {
    "policy_version": {
      "description": "Monotonic version of this document. Required; greater than zero, and each successor for\nthe same estate carries a strictly greater value.",
      "type": "integer",
      "format": "uint64",
      "minimum": 0
    },
    "produced_at": {
      "description": "Instant this document was produced, on the producing service's clock. Required.\nProducer-asserted authority: it is neither a publish nor a receive instant, and no other\nparty can verify it.",
      "$ref": "#/$defs/WireTimestamp"
    },
    "producing_service": {
      "description": "Deployable service that produced this document, e.g. `ratatoskr-github`. Required.",
      "$ref": "#/$defs/ProducerName"
    },
    "repositories": {
      "description": "Per-repository entries. Omitted when this version names no repository, which leaves\nevery catalog repository uncovered until a successor names it.",
      "type": "array",
      "items": {
        "$ref": "#/$defs/RepositoryBackupEntry"
      }
    }
  },
  "additionalProperties": true,
  "required": [
    "policy_version",
    "produced_at",
    "producing_service"
  ],
  "x-ratatoskr-provenance": {
    "canonical_source": "ratatoskr_backup_contracts::DesiredBackupPolicy",
    "contract_id": "backup.desired_backup_policy",
    "contract_major_version": 1,
    "generated": "DO NOT EDIT — generated by contractsc from the canonical Rust source. Change the Rust type and run `cargo contracts generate`.",
    "generator": "contractsc",
    "generator_version": "0.1.0",
    "schemars_version": "1.2.2",
    "source_digest": "sha256:1bd1819d2739eeeeb86d755e114618e13d4b7a3d936a9b7d07dca181d62cc8c1",
    "validation_note": "This schema is a LOWER BOUND on validity. Cross-field invariants and canonical-form rules are enforced by the canonical Rust type; see fixtures/invalid-expectations.toml for which layer rejects what."
  },
  "x-ratatoskr-unknown-policy": "preserve",
  "$defs": {
    "BackupExclusion": {
      "description": "One explicit narrowing of a repository's mirrored set.\n\nAn exclusion only ever removes candidates; it can never widen what is mirrored.",
      "type": "object",
      "properties": {
        "expression": {
          "description": "The carrier-safe expression the consuming mirror applies. Required.",
          "$ref": "#/$defs/ExclusionExpression"
        },
        "scope": {
          "description": "Which kind of thing `expression` matches. Required.",
          "$ref": "#/$defs/BackupExclusionScope"
        }
      },
      "required": [
        "expression",
        "scope"
      ]
    },
    "BackupExclusionScope": {
      "description": "What an exclusion's expression matches inside a repository.\n\n**Closed on purpose**: the scope decides which matcher interprets the expression downstream,\nand guessing a scope silently changes what is mirrored.",
      "oneOf": [
        {
          "description": "The expression matches git refnames (branches and tags) of the mirrored repository.",
          "type": "string",
          "const": "refs_matching"
        },
        {
          "description": "The expression matches paths inside the mirrored tree.",
          "type": "string",
          "const": "paths_matching"
        }
      ]
    },
    "BackupPriorityHint": {
      "description": "How urgently a repository's mirror should be brought up relative to its siblings.\n\n**Closed on purpose**: ordering drives scheduling under contention, and an unrecognized hint\nsilently reorders backups. A hint, never a guarantee — Vault schedules within its own\ncapacity.",
      "oneOf": [
        {
          "description": "Mirror before anything else; loss of fresh state is unacceptable.",
          "type": "string",
          "const": "critical"
        },
        {
          "description": "Ordinary scheduling.",
          "type": "string",
          "const": "standard"
        },
        {
          "description": "Mirror only when capacity allows; archival depth matters more than freshness.",
          "type": "string",
          "const": "bulk"
        }
      ]
    },
    "EntityRef": {
      "title": "EntityRef",
      "description": "A namespaced, polymorphic wire reference, serialized as `<kind>:<local_id>`. The kind vocabulary is open: an unrecognised kind is preserved verbatim. The local identity is opaque and need not be a UUID; when it is one it must be the canonical lowercase hyphenated spelling, so one identity has one reference. Equality is octet equality of `<kind>:<local_id>`: the kind is lowercase by grammar, and the local part is case-sensitive and never case-folded, because provider identities are case-significant. This rule is narrower than the `pattern` below, which cannot express it.",
      "type": "string",
      "examples": [
        "document:018f0000-0000-7000-8000-000000000002",
        "x-post:123"
      ],
      "maxLength": 289,
      "pattern": "^[a-z][a-z0-9_-]{0,31}:[A-Za-z0-9][A-Za-z0-9._~:@+-]{0,255}$"
    },
    "ExclusionExpression": {
      "title": "ExclusionExpression",
      "description": "One exclusion expression: carrier-safe opaque text whose interpretation - refname globs or path patterns - follows the enclosing exclusion's scope. Non-empty and at most 256 UTF-8 bytes; the ban on C0 control characters and DEL is enforced by the Rust type and is narrower than this schema.",
      "type": "string",
      "examples": [
        "refs/heads/scratch/*",
        "tmp/**"
      ],
      "maxLength": 256,
      "minLength": 1
    },
    "MirrorCadence": {
      "description": "How often a repository's mirror is refreshed.\n\n**Closed on purpose.** The class decides backup frequency, so an unrecognized value must stop\nprocessing instead of being read as some default cadence. Coarse classes only: mapping a\nclass onto concrete intervals is Vault-scheduler territory, not wire grammar. Adding a\nvariant later is an additive, non-breaking expansion.",
      "oneOf": [
        {
          "description": "Mirror immediately on every observed change.",
          "type": "string",
          "const": "eager"
        },
        {
          "description": "Refresh the mirror at least once per UTC day.",
          "type": "string",
          "const": "daily"
        },
        {
          "description": "Refresh the mirror at least once per UTC week.",
          "type": "string",
          "const": "weekly"
        }
      ]
    },
    "ProducerName": {
      "title": "ProducerName",
      "description": "The deployable that emitted this record, e.g. `ratatoskr-extractor`.\n\nA deployment identity, not an instance identity: never a hostname, pod name, region or\nbuild version. Kebab-case, because the service names in `README.md` and\n`ARCHITECTURE.md` S5.2 are kebab-case. Every value used inside this repository must be\nregistered in `contracts.toml [services].known`.",
      "type": "string",
      "examples": [
        "ratatoskr-extractor",
        "ratatoskr-x"
      ],
      "maxLength": 64,
      "pattern": "^[a-z][a-z0-9-]{1,63}$"
    },
    "RepositoryBackupEntry": {
      "description": "One repository's desired backup depth inside a policy version.",
      "type": "object",
      "properties": {
        "exclusions": {
          "description": "Explicit exclusions narrowing the mirrored set. Omitted when nothing is excluded; an\nexclusion only ever narrows.",
          "type": "array",
          "items": {
            "$ref": "#/$defs/BackupExclusion"
          }
        },
        "mirror_cadence": {
          "description": "Coarse refresh-cadence class. Required; see [`MirrorCadence`].",
          "$ref": "#/$defs/MirrorCadence"
        },
        "priority_hint": {
          "description": "Relative urgency hint. Required; see [`BackupPriorityHint`].",
          "$ref": "#/$defs/BackupPriorityHint"
        },
        "repository_ref": {
          "description": "The repository this entry governs, spelled `repository:<uuid>` in the shared pointer\ngrammar. Required. Two entries of one policy never name the same reference.",
          "$ref": "#/$defs/EntityRef"
        },
        "size_hint_bytes": {
          "description": "Upper-bound size estimate for the repository, in bytes. Omitted when the producer does\nnot know it; never zero-meaningful.",
          "type": [
            "integer",
            "null"
          ],
          "format": "uint64",
          "minimum": 0
        }
      },
      "required": [
        "mirror_cadence",
        "priority_hint",
        "repository_ref"
      ]
    },
    "WireTimestamp": {
      "title": "WireTimestamp",
      "description": "An instant on the wire: RFC 3339 in UTC with the literal `Z` designator. Exactly one spelling is accepted per instant — an input that does not re-render to itself is rejected. The field holding it declares the clock authority.",
      "type": "string",
      "format": "date-time",
      "examples": [
        "2026-08-17T10:00:00Z"
      ],
      "pattern": "^\\d{4}-\\d{2}-\\d{2}T\\d{2}:\\d{2}:\\d{2}(\\.\\d{1,9})?Z$"
    }
  }
}
