{
  "policy_version": 3,
  "producing_service": "ratatoskr-github",
  "produced_at": "2026-08-20T09:00:00Z",
  "repositories": [
    {
      "repository_ref": "repository:018f0000-0000-7000-8000-000000000501",
      "mirror_cadence": "daily",
      "priority_hint": "critical",
      "size_hint_bytes": 2147483648,
      "exclusions": [
        {
          "scope": "refs_matching",
          "expression": "refs/heads/scratch/*"
        },
        {
          "scope": "paths_matching",
          "expression": "tmp/**"
        }
      ]
    },
    {
      "repository_ref": "repository:018f0000-0000-7000-8000-000000000502",
      "mirror_cadence": "weekly",
      "priority_hint": "bulk"
    }
  ]
}
